<?xml version="1.0" encoding="utf-8"?>

<UnitaDocumentaria xmlns:xsi="http://www.w3.org/2001/XMLSchema-instance"
	xsi:noNamespaceSchemaLocation="WSVersamentoRequest.xsd">
	<Intestazione>
		<Versatore>
			<Ambiente>abc</Ambiente>
			<Ente>abc</Ente>
			<Struttura>abc</Struttura>
			<UserID>abc</UserID>
		</Versatore>
		<Chiave>
			<Numero>12</Numero>
			<Anno>2000</Anno>
			<TipoRegistro>REGISTRO</TipoRegistro>			
		</Chiave>
		<TipologiaUnitaDocumentaria>asd</TipologiaUnitaDocumentaria>
	</Intestazione>
	<Configurazione>
		<TipoConservazione>SOSTITUTIVA</TipoConservazione>	
		<ForzaAccetazione>true</ForzaAccetazione>
		<ForzaConservazione>true</ForzaConservazione>
		<ForzaCollegamento>true</ForzaCollegamento>
	</Configurazione>
	<ProfiloArchivistico>
		<FascicoloPrincipale>
			<Fascicolo>
				<Identificativo>123</Identificativo>
				<Oggetto>asd</Oggetto>
			</Fascicolo>
		</FascicoloPrincipale>
		<FascicoliSecondari>
			<FascicoloSecondario>
				<Fascicolo>
					<Identificativo>123</Identificativo>
					<Oggetto>asd</Oggetto>
				</Fascicolo>
				<SottoFascicolo>
					<Identificativo>123</Identificativo>
					<Oggetto>asd</Oggetto>
				</SottoFascicolo>
			</FascicoloSecondario>
			<FascicoloSecondario>
				<Classifica>1</Classifica>
			</FascicoloSecondario>
			<FascicoloSecondario />
		</FascicoliSecondari>
	</ProfiloArchivistico>
	<ProfiloUnitaDocumentaria>
		<Oggetto>abc</Oggetto>
		<Data>2011-10-10</Data>
	</ProfiloUnitaDocumentaria>
	<DocumentiCollegati>
		<DocumentoCollegato>
			<ChiaveCollegamento>
				<Numero>123</Numero>
				<Anno>1234</Anno>
				<TipoRegistro>REGISTRO</TipoRegistro>
			</ChiaveCollegamento>
			<DescrizioneCollegamento>asd</DescrizioneCollegamento>
		</DocumentoCollegato>
	</DocumentiCollegati>
	<NumeroAllegati>0</NumeroAllegati>
	<NumeroAnnessi>0</NumeroAnnessi>
	<NumeroAnnotazioni>0</NumeroAnnotazioni>
	<DocumentoPrincipale>
		<IDDocumento>123</IDDocumento>
		<TipoDocumento>FILE</TipoDocumento>
		<ProfiloDocumento></ProfiloDocumento>
		<DatiFiscali>
			<DataEmissione>2010-10-10</DataEmissione>
			<NumeroProgressivo>123</NumeroProgressivo>
			<Registro>REGISTRO</Registro>
			<PeriodoFiscale>periodo</PeriodoFiscale>
			<DataTermineEmissione>2011-11-11</DataTermineEmissione>
		</DatiFiscali>
		<StrutturaOriginale>
			<TipoStruttura>STRUTTURA</TipoStruttura>
			<Componenti>
				<Componente>
					<ID>123</ID>
					<OrdinePresentazione>1</OrdinePresentazione>
					<TipoComponente>FILE</TipoComponente>
					<TipoSupportoComponente>FILE</TipoSupportoComponente>
					<UtilizzoDataFirmaPerRifTemp>false</UtilizzoDataFirmaPerRifTemp>
				</Componente>
			</Componenti>
		</StrutturaOriginale>
	</DocumentoPrincipale>
</UnitaDocumentaria>